,title,text
20,Can my ex hide all our assets under an LLP so I don’t get half in our divorce?,"I am going through a divorce with my ex, we have two children, a mortgage, two car loans, and a good amount of stuff. As of this writing I have filled divorce but we’re still officially married. We’re in Texas.


Last fall, while we were married, he formed three companies: a LLP which owns a for-profit LLC which owns a non-profit LLC. According to the business structure, he and I each have a 1% stake in the LLP, and each of the LLCs own 49% stake in the LLP. My ex owns 100% of the for-profit LLC, which owns 100% of the non-profit LLC. There was no official legal counsel consulted for the formation of these companies; he got a Partnership Agreement template for the LLC from a LegalZoom equivalent. I do have a copy of that I can consult if questions arise.


He basically is trying to turn our “estate” into a business. He says the LLP owns our house and all our assets and liabilities. *He* and *I* don’t actually own anything, it’s all considered a depreciable asset of the LLP. According to his 2022 Annual Report, each of the 3 companies are considered a “Real Estate Investment Trust” and none of them have any tax due. He hasn’t done any business with the for-profit or non-profit LLCs, no clients, $0 in the business bank accounts.


If you check the public records for our home, only his and my names are on the deed of our house, not any of the companies.


He did a complete estate asset valuation table that included almost every item in our home that we own. I’ll mention, last spring we sold our first house and got a pretty hefty cash profit, about $80k of which went into a down payment and upgrades on our current house. The remaining $80k he pretty much unilaterally spent on STUFF. I wanted to invest, I tried to save, but he spent it, and more, putting us further in credit card debt. Our couples therapist heavily suspected Narcissistic Personality Disorder, that coupled with lots of other stuff led to me filing for divorce.


It was my understanding that in the divorce, I am entitled to half our community property, or realistically half the fair market value of our community property. Especially since he spent all our cash, we can’t afford our mortgage, car payments, and preschool tuition without his mom’s help, so all we really have is *stuff*.


I wrote up a proposal because we’re trying to settle out of court. I do have legal representation (I’m going to confer with him about this of course, but I want to be armed with all the info I can), but my ex is representing himself. We agree on custody entirely (50/50), and he didn’t seem to have an issue with the standard child support calculator. We mutually want a good-faith, inexpensive, efficient, out-of-court settlement.


Upon reading my proposal, he said I have NO claim to half the value of our assets because they’re owned by the LLP. I don’t think he has an issue physically giving me some stuff, but he doesn’t think he owes me half the fair market value of the community property he’s keeping. Is that legit? Everything I’ve read about hiding assets from divorce in LLCs is referencing LLCs formed PRIOR to marriage, where the assets wouldn’t be community property. He says I’m entitled to half the equity of our LLP, which is all our assets minus all our liabilities, which conveniently equals zero according to his valuations. 


I’m well over my head here, and trying not to be the victim of his mental/emotional/financial abuse anymore. If anyone has read this far and has input, I am so grateful."
21,"My son has started refusing to come over for visitation, and my ex is not following any of the court orders. What can i do?","I have an order of joint custody (im non-custodial) and a standard visitation order following oklahoma law. My son who is 7 has started refusing to come over and giving every excuse imaginable from ""i dont play with him"" to ""i ignore him"" which isn't true but his mother refuses to listen. Whenever asked to be more encouraging instead of simply saying ""you dont have to go if you dont want to"" she just replies that shes not forcing her autistic son to do something he doesnt want to. This also isnt the first time this has happened. After looking at it further she hasnt followed a single one of the courts orders, she always makes plans on my weekends with him and in the 4 years since the court order hes stayed the night a total of 4 times. I had to have myself added to his medical records by contacting the hospital and giving them the court order, and had to do the same for his old school. I dont even know what school he is in now and i certainly havnt been added to his contact list. 

&#x200B;

So are there any options or steps i can take before finding a lawyer and making it a full blown court battle? Ive tried contacting DHS already but they told me they dont handle that kind of issue."
22,Billed for No Services Rendered,"Apologies if this is the wrong sub, not sure exactly where it belongs.  This is in PA.

In 2018 my husband and I purchased a LG washer and drier.  The salesman convinced us to purchase a warranty which we later realized was money wasted.  The warranty was from Consumer Protection Services (CPS).

In January the washer dies and we are in dire straights because we have a newborn and are using it for multiple loads daily.  We submit a claim using the CPS website.  The claim is accepted and a company called LG Electronics Alabama, Inc is assigned the repair with a date scheduled.  In the meantime we are frantically searching for a place that can repair it sooner. 

We find another repair place and the washer gets fixed.  LG Electronics Alabama, Inc gets in contact with my husband for the appointment and he cancels it (he has all the texts saved).  I checked the CPS website and couldn't find a way to officially cancel the claim online so I just left it open.  Probably should have called to talk to someone but had other newborn stuff to do.

Fast forward to yesterday and we receive a bill in the mail for $268 for ""Service call not covered under warranty”.  Bill dated 4-11.  Of course we call and can't get through so I send an email to the address listed on the bill explaining the situation and asking for proof of services rendered.

If the appointment was cancelled and no services were provided I can't just be billed, right?  I am hoping this is just a mistake, but if CPS pushes back, what are my best options?  I don't want to go through the hassle of getting a fighting a ding on my credit for not paying a fabricated bill."
23,"Bank closed my account for (allegedly) suspected fraud, and now refuses to return my funds that were in my account","I am an American living abroad, and I had a checking account in my former home state of Ohio. I had been with this bank for more than 2 decades and have been using various services (Paypal, Wise, etc) to move money between that bank and where I am living abroad.

My aunt passed away and left me part of her ownership of a building she rented out with her brother (my uncle), to be paid out in monthly payments. This past November, my uncle sent 2 checks to my friend in Cleveland, one for $1000, the other for $4050. My friend deposited them to my checking account on my behalf, writing ""For Deposit Only"" on the back. Shortly after the checks were deposited, a week-long hold was placed on both of them, which I thought was to be expected given that previously we had been using Zelle to make my monthly payments.

But then after a week, the bank refused to lift the hold on the checks, claiming they were ""Still trying to determine the source of funds"". My uncle also sends these checks to my sister each month, and she has been depositing them with no problem at her bank, so not sure why they had trouble with my checks.

I kept using the bank's online chat service to ask for updates, but the hold remained on the checks for 3 months, saying they were still ""investigating"". Finally, last month, they informed me they were closing my account for suspected fraud and that I couldn't dispute their decision. The sent a letter to my friend just last weekend announcing that the account had been closed, and the letter said ""If there was a positive balance in the account, a check will be included with this letter."" The letter included my final statement which showed I had $5050.01 in my account, but there was no check included. I got on the bank's chat program again and asked them about the status of the check, and they said they were still investigating the funds and there was no ETA on when (or even if) they would send the check.

It's already been 6 months since my friend deposited those checks. I think that's more than enough time to ""investigate the funds"". To me, it sounds like the bank just intends to keep the money and never return it to me. Do I have any legal options to get this bank to stop stringing me along and return my money to me? I'm sick of this and just want it to be over so all involved can move on.

**EDIT 1:** Here's the redacted letter my friend received. Again, no check was included with the letter, even though they also sent me a statement showing $5050.01 in my account:

[https://i.imgur.com/uSuqKPn.png](https://i.imgur.com/uSuqKPn.png)

**EDIT 2 :** It seems like my next step is to contact the CFPB and the OCC. Hopefully this lights a fire under the bank and they just decide it's not worth the trouble dragging this out any longer. I mean, they already won. They closed my account and got rid of me as a customer. All I want is my money back and I'll be on my merry way. 

Thanks for all the advice!"
24,Apartment won’t give my application deposit back,"My boyfriend and I applied for an apartment last November with a $750 application fee/holding deposit and were denied after waiting a whole month to hear back (we were fresh out of grad school and couldn’t provide pay stubs, we toured the place and they said offer letters from our jobs would be okay then went back on their word, but that’s beside the point). We were told we would get the deposit back within 4-6 weeks. 

We were about to start the process of moving out of the apartment we stayed in during grad school, and each of us went to our parents’ homes for the holidays. When we were rejected, I spoke with someone on the phone AND sent an email asking them to send our check to my parents’ address instead, knowing it would take forever. I have an email from them confirming they had received my email and would request the check be sent there. 

Well we never got the check back and obviously ended up moving into a different apartment building in the same area. I went in person back in January and was told they had sent the check to the old address, our graduate school apartment, despite their email confirmation that it would be sent to my parents’ address! They said they would cancel the original check and issue a new one, to expect it in 3-4 weeks. It’s been 3 months and nothing. We’ve tried calling, they never answer. Emailing, they never get back to us. Our work hours don’t align with their hours, so now that we’ve started our jobs it’s impossible to go in person. What are our options and what are the laws about this? We’re in New York if that matters."
